<?xml version="1.0" encoding="UTF-8"?>
<parc nom="CoperAventura S.A." xmlns:xs="http://www.w3.org/2001/XMLSchema-instance" xs:noNamespaceSchemaLocation="parc.xsd">
  <!---->
  <adreca>Passeig de la sort, 1</adreca>
  <ciutat>Can Puces</ciutat>
  <pais>Espanya</pais>
  <paginaWeb>http://www.coperaventura.com</paginaWeb>
  <dates>
    <dataObertura>2020-07-08</dataObertura>
    <dataTancament>2020-01-10</dataTancament>
  </dates>
  <horaris>
    <mes nom="Juliol">
      <horaObertura hora="10:00:00">
        <periode diaInici="1" diaFinal="31">
          <diaSetmana>Dilluns</diaSetmana>
          <diaSetmana>Dimarts</diaSetmana>
          <diaSetmana>Dimecres</diaSetmana>
          <diaSetmana>Dijous</diaSetmana>
          <diaSetmana>Divendres</diaSetmana>
          <diaSetmana>Dissabte</diaSetmana>
          <diaSetmana>Diumenge</diaSetmana>
        </periode>
      </horaObertura>
      <horaTancament hora="22:00:00">
        <periode diaInici="1" diaFinal="31">
          <diaSetmana>Dilluns</diaSetmana>
          <diaSetmana>Dimarts</diaSetmana>
          <diaSetmana>Dimecres</diaSetmana>
          <diaSetmana>Dijous</diaSetmana>
          <diaSetmana>Divendres</diaSetmana>
          <diaSetmana>Dissabte</diaSetmana>
          <diaSetmana>Diumenge</diaSetmana>
        </periode>
      </horaTancament>
    </mes>
    <mes nom="Agost">
      <horaObertura hora="10:00:00">
        <periode diaInici="1" diaFinal="31">
          <diaSetmana>Dilluns</diaSetmana>
          <diaSetmana>Dimarts</diaSetmana>
          <diaSetmana>Dimecres</diaSetmana>
          <diaSetmana>Dijous</diaSetmana>
          <diaSetmana>Divendres</diaSetmana>
          <diaSetmana>Dissabte</diaSetmana>
          <diaSetmana>Diumenge</diaSetmana>
        </periode>
      </horaObertura>
      <horaTancament hora="22:00:00">
        <periode diaInici="1" diaFinal="31">
          <diaSetmana>Dilluns</diaSetmana>
          <diaSetmana>Dimarts</diaSetmana>
          <diaSetmana>Dimecres</diaSetmana>
          <diaSetmana>Dijous</diaSetmana>
          <diaSetmana>Divendres</diaSetmana>
          <diaSetmana>Dissabte</diaSetmana>
          <diaSetmana>Diumenge</diaSetmana>
        </periode>
      </horaTancament>
    </mes>
    <mes nom="Setembre">
      <horaObertura hora="10:00:00">
        <periode diaInici="1" diaFinal="30">
          <diaSetmana>Dilluns</diaSetmana>
          <diaSetmana>Dimarts</diaSetmana>
          <diaSetmana>Dimecres</diaSetmana>
          <diaSetmana>Dijous</diaSetmana>
          <diaSetmana>Divendres</diaSetmana>
          <diaSetmana>Dissabte</diaSetmana>
          <diaSetmana>Diumenge</diaSetmana>
        </periode>
      </horaObertura>
      <horaTancament hora="20:00:00">
        <periode diaInici="14" diaFinal="30">
          <diaSetmana>Dilluns</diaSetmana>
          <diaSetmana>Dimarts</diaSetmana>
          <diaSetmana>Dimecres</diaSetmana>
          <diaSetmana>Dijous</diaSetmana>
          <diaSetmana>Divendres</diaSetmana>
          <diaSetmana>Diumenge</diaSetmana>
        </periode>
      </horaTancament>
      <horaTancament hora="22:00:00">
        <periode diaInici="1" diaFinal="13">
          <diaSetmana>Dilluns</diaSetmana>
          <diaSetmana>Dimarts</diaSetmana>
          <diaSetmana>Dimecres</diaSetmana>
          <diaSetmana>Dijous</diaSetmana>
          <diaSetmana>Divendres</diaSetmana>
          <diaSetmana>Dissabte</diaSetmana>
          <diaSetmana>Diumenge</diaSetmana>
        </periode>
        <periode diaInici="14" diaFinal="30">
          <diaSetmana>Dissabte</diaSetmana>
        </periode>
      </horaTancament>
    </mes>
    <mes nom="Octubre">
      <horaObertura hora="10:00:00">
        <periode diaInici="1" diaFinal="30">
          <diaSetmana>Dilluns</diaSetmana>
          <diaSetmana>Dimarts</diaSetmana>
          <diaSetmana>Dimecres</diaSetmana>
          <diaSetmana>Dijous</diaSetmana>
          <diaSetmana>Divendres</diaSetmana>
          <diaSetmana>Dissabte</diaSetmana>
          <diaSetmana>Diumenge</diaSetmana>
        </periode>
      </horaObertura>
      <horaTancament hora="20:00:00">
        <periode diaInici="1" diaFinal="31">
          <diaSetmana>Dilluns</diaSetmana>
          <diaSetmana>Dimarts</diaSetmana>
          <diaSetmana>Dimecres</diaSetmana>
          <diaSetmana>Dijous</diaSetmana>
          <diaSetmana>Divendres</diaSetmana>
          <diaSetmana>Diumenge</diaSetmana>
        </periode>
      </horaTancament>
      <horaTancament hora="22:00:00">
        <periode diaInici="11" diaFinal="11">
          <diaSetmana>Diumenge</diaSetmana>
        </periode>
        <periode diaInici="1" diaFinal="31">
          <diaSetmana>Dissabte</diaSetmana>
        </periode>
      </horaTancament>
    </mes>
    <mes nom="Novembre">
      <horaObertura hora="10:00:00">
        <periode diaInici="1" diaFinal="30">
          <diaSetmana>Dissabte</diaSetmana>
          <diaSetmana>Diumenge</diaSetmana>
        </periode>
      </horaObertura>
      <horaTancament hora="18:00:00">
        <periode diaInici="1" diaFinal="30">
          <diaSetmana>Dissabte</diaSetmana>
          <diaSetmana>Diumenge</diaSetmana>
        </periode>
      </horaTancament>
      <horaTancament hora="22:00:00">
        <periode diaInici="7" diaFinal="7">
          <diaSetmana>Dissabte</diaSetmana>
        </periode>
        <periode diaInici="14" diaFinal="14">
          <diaSetmana>Dissabte</diaSetmana>
        </periode>
      </horaTancament>
    </mes>
    <mes nom="Desembre">
      <horaObertura hora="10:00:00">
        <periode diaInici="1" diaFinal="31">
          <diaSetmana>Dissabte</diaSetmana>
          <diaSetmana>Diumenge</diaSetmana>
        </periode>
        <periode diaInici="7" diaFinal="8">
          <diaSetmana>Dilluns</diaSetmana>
          <diaSetmana>Dimarts</diaSetmana>
        </periode>
        <periode diaInici="21" diaFinal="25">
          <diaSetmana>Dilluns</diaSetmana>
          <diaSetmana>Dimarts</diaSetmana>
          <diaSetmana>Dimecres</diaSetmana>
          <diaSetmana>Dijous</diaSetmana>
          <diaSetmana>Divendres</diaSetmana>
        </periode>
        <periode diaInici="28" diaFinal="30">
          <diaSetmana>Dimecres</diaSetmana>
          <diaSetmana>Dijous</diaSetmana>
          <diaSetmana>Divendres</diaSetmana>
        </periode>
      </horaObertura>
      <horaTancament hora="18:00:00">
        <periode diaInici="1" diaFinal="31">
          <diaSetmana>Dissabte</diaSetmana>
          <diaSetmana>Diumenge</diaSetmana>
        </periode>
        <periode diaInici="7" diaFinal="8">
          <diaSetmana>Dilluns</diaSetmana>
          <diaSetmana>Dimarts</diaSetmana>
        </periode>
        <periode diaInici="21" diaFinal="25">
          <diaSetmana>Dilluns</diaSetmana>
          <diaSetmana>Dimarts</diaSetmana>
          <diaSetmana>Dimecres</diaSetmana>
          <diaSetmana>Dijous</diaSetmana>
          <diaSetmana>Divendres</diaSetmana>
        </periode>
        <periode diaInici="28" diaFinal="30">
          <diaSetmana>Dimecres</diaSetmana>
          <diaSetmana>Dijous</diaSetmana>
          <diaSetmana>Divendres</diaSetmana>
        </periode>
      </horaTancament>
    </mes>
    <mes nom="Gener">
      <horaObertura hora="10:00:00">
        <periode diaInici="1" diaFinal="10">
          <diaSetmana>Dilluns</diaSetmana>
          <diaSetmana>Dimarts</diaSetmana>
          <diaSetmana>Dimecres</diaSetmana>
          <diaSetmana>Dijous</diaSetmana>
          <diaSetmana>Divendres</diaSetmana>
          <diaSetmana>Dissabte</diaSetmana>
          <diaSetmana>Diumenge</diaSetmana>
        </periode>
      </horaObertura>
      <horaTancament hora="18:00:00">
        <periode diaInici="1" diaFinal="10">
          <diaSetmana>Dilluns</diaSetmana>
          <diaSetmana>Dimarts</diaSetmana>
          <diaSetmana>Dimecres</diaSetmana>
          <diaSetmana>Dijous</diaSetmana>
          <diaSetmana>Divendres</diaSetmana>
          <diaSetmana>Dissabte</diaSetmana>
          <diaSetmana>Diumenge</diaSetmana>
        </periode>
      </horaTancament>
    </mes>
  </horaris>
  <atraccions>
    <zona nom="ESO">
      <atraccio nom="Pati Mission">
        <servei>PassPreferent</servei>
        <servei>Accés discapacitat</servei>
        <servei>Fotografia</servei>
        <servei>Vídeo</servei>
        <alcadaMinima adult="1">1.10</alcadaMinima>
        <alcadaMinima adult="0">1.20</alcadaMinima>
        <intensitat>Infantil</intensitat>
      </atraccio>
      <atraccio nom="L’aula misteriosa">
        <servei>Accés discapacitat</servei>
        <intensitat>Infantil</intensitat>
      </atraccio>
      <atraccio nom="Magic entrepà">
        <alcadaMinima adult="1">1.30</alcadaMinima>
        <alcadaMinima adult="0">1.40</alcadaMinima>
        <intensitat>Infantil</intensitat>
      </atraccio>
      <atraccio nom="Profe-Profe">
        <servei>Accés discapacitat</servei>
        <servei>Fotografia</servei>
        <alcadaMinima adult="1">1</alcadaMinima>
        <alcadaMinima adult="0">1.30</alcadaMinima>
        <intensitat>Infantil</intensitat>
      </atraccio>
      <atraccio nom="El salt a la pissarra">
        <servei>Accés discapacitat</servei>
        <alcadaMinima adult="1">0.95</alcadaMinima>
        <alcadaMinima adult="0">1.30</alcadaMinima>
        <intensitat>Infantil</intensitat>
      </atraccio>
    </zona>
    <zona nom="Batxillerat">
      <atraccio nom="Furius Selectivity">
        <servei>PassPreferent</servei>
        <servei>Accés discapacitat</servei>
        <servei>Fotografia</servei>
        <servei>Vídeo</servei>
        <alcadaMinima adult="0">1.40</alcadaMinima>
        <alcadaMaxima>1.95</alcadaMaxima>
        <intensitat>Forta</intensitat>
      </atraccio>
      <atraccio nom="Examen Splash">
        <servei>PassPreferent</servei>
        <servei>Accés discapacitat</servei>
        <servei>Fotografia</servei>
        <alcadaMinima adult="1">1.30</alcadaMinima>